{
  "schema_version": 1,
    "framework": "network",
    "version": "1.0",
    "description": "Network sinks — socket, ftp, smtp, dns, ssrf, ldap, webhooks",
    "detection": {
        "imports": [
            "socket",
            "ftplib",
            "smtplib",
            "ldap",
            "ldap3",
            "import socket",
            "import ftplib",
            "import smtplib",
            "from ldap"
        ],
        "patterns": [
            "socket.create_connection(",
            "FTP(",
            "SMTP(",
            "search(",
            "dns.resolver"
        ]
    },
    "models": [
        {"call": "socket.create_connection", "taint_sink": true},
        {"call": "socket.socket.connect", "taint_sink": true},
        {"call": "socket.gethostbyname", "taint_sink": true},
        {"call": "socket.gethostbyname_ex", "taint_sink": true},
        {"call": "socket.getaddrinfo", "taint_sink": true},
        {"call": "ftplib.FTP.connect", "taint_sink": true},
        {"call": "ftplib.FTP.login", "taint_sink": true},
        {"call": "ftplib.FTP.retrbinary", "taint_sink": true},
        {"call": "ftplib.FTP.retrlines", "taint_sink": true},
        {"call": "ftplib.FTP.storbinary", "taint_sink": true},
        {"call": "ftplib.FTP.storlines", "taint_sink": true},
        {"call": "smtplib.SMTP.sendmail", "taint_sink": true},
        {"call": "smtplib.SMTP.send_message", "taint_sink": true},
        {"call": "smtplib.SMTP_SSL.sendmail", "taint_sink": true},
        {"call": "dns.resolver.Resolver.resolve", "taint_sink": true},
        {"call": "dns.resolver.Resolver.query", "taint_sink": true},
        {"call": "dns.query.tcp", "taint_sink": true},
        {"call": "dns.query.udp", "taint_sink": true},
        {"call": "dns.query.https", "taint_sink": true},
        {"call": "dns.query.tls", "taint_sink": true},
        {"call": "dns.message.make_query", "taint_sink": true},
        {"call": "ldap.ldapobject.SimpleLDAPObject.search", "taint_sink": true},
        {"call": "ldap.ldapobject.SimpleLDAPObject.search_s", "taint_sink": true},
        {"call": "ldap.ldapobject.SimpleLDAPObject.search_ext", "taint_sink": true},
        {"call": "ldap.ldapobject.SimpleLDAPObject.search_ext_s", "taint_sink": true},
        {"call": "ldap3.Connection.search", "taint_sink": true},
        {"call": "ldap3.Connection.extend.standard.paged_search", "taint_sink": true},
        {
            "call": "urllib.request.urlopen",
            "taint_sink": true,
            "taint_source": true,
            "category": "network"
        },
        {"call": "urllib.request.urlretrieve", "taint_sink": true},
        {"call": "urllib.request.Request", "taint_sink": true},
        {"call": "http.client.HTTPConnection.request", "taint_sink": true},
        {"call": "http.client.HTTPSConnection.request", "taint_sink": true},
        {"call": "urllib3.PoolManager.request", "taint_sink": true},
        {
            "call": "urllib3.connectionpool.HTTPConnectionPool.urlopen",
            "taint_sink": true
        },
        {"call": "httpx.AsyncClient.get", "taint_sink": true},
        {"call": "httpx.AsyncClient.post", "taint_sink": true},
        {"call": "httpx.AsyncClient.request", "taint_sink": true},
        {"call": "aiohttp.ClientSession.get", "taint_sink": true},
        {"call": "aiohttp.ClientSession.post", "taint_sink": true},
        {"call": "aiohttp.ClientSession.request", "taint_sink": true},
        {"call": "requests.post", "taint_sink": true},
        {"call": "slack_sdk.WebClient.chat_postMessage", "taint_sink": true},
        {"call": "slack_sdk.WebClient.chat_update", "taint_sink": true},
        {"call": "slack_sdk.WebClient.files_upload", "taint_sink": true},
        {"call": "discord.Webhook.send", "taint_sink": true},
        {"call": "discord.Client.send_message", "taint_sink": true},
        {"call": "discord.abc.Messageable.send", "taint_sink": true},
        {"call": "discord.TextChannel.send", "taint_sink": true},
        {"call": "twilio.rest.Client.messages.create", "taint_sink": true},
        {"call": "twilio.rest.Client.calls.create", "taint_sink": true},
        {"call": "sendgrid.SendGridAPIClient.send", "taint_sink": true},
        {"call": "sendgrid.helpers.mail.Mail", "taint_sink": true},
        {"call": "telegram.Bot.send_message", "taint_sink": true},
        {"call": "telegram.Bot.send_photo", "taint_sink": true},
        {"call": "telegram.Bot.send_document", "taint_sink": true},
        {"call": "atproto_client.Client.send_post", "taint_sink": true},
        {
            "call": "socket.socket",
            "typestate_open": true,
            "typestate_protocol": "socket",
            "typestate_action": "open",
            "resource_arg_positions": [],
            "module_prefixes": ["socket"]
        },
        {
            "call": "socket.create_connection",
            "typestate_open": true,
            "typestate_protocol": "socket",
            "typestate_action": "open",
            "resource_arg_positions": [],
            "module_prefixes": ["socket"]
        },
        {
            "call": "shutdown",
            "typestate_close": true,
            "typestate_protocol": "socket",
            "typestate_action": "close",
            "receiver_types": ["socket.socket", "socket.create_connection"]
        },
        {
            "call": "send",
            "typestate_use": true,
            "typestate_protocol": "socket",
            "typestate_action": "use",
            "receiver_types": ["socket.socket", "socket.create_connection"]
        },
        {
            "call": "sendall",
            "typestate_use": true,
            "typestate_protocol": "socket",
            "typestate_action": "use",
            "receiver_types": ["socket.socket", "socket.create_connection"]
        },
        {
            "call": "sendto",
            "typestate_use": true,
            "typestate_protocol": "socket",
            "typestate_action": "use",
            "receiver_types": ["socket.socket", "socket.create_connection"]
        },
        {
            "call": "recv",
            "typestate_use": true,
            "typestate_protocol": "socket",
            "typestate_action": "use",
            "receiver_types": ["socket.socket", "socket.create_connection"]
        },
        {
            "call": "recvfrom",
            "typestate_use": true,
            "typestate_protocol": "socket",
            "typestate_action": "use",
            "receiver_types": ["socket.socket", "socket.create_connection"]
        },
        {
            "call": "connect",
            "typestate_use": true,
            "typestate_protocol": "socket",
            "typestate_action": "use",
            "receiver_types": ["socket.socket", "socket.create_connection"]
        },
        {
            "call": "bind",
            "typestate_use": true,
            "typestate_protocol": "socket",
            "typestate_action": "use",
            "receiver_types": ["socket.socket", "socket.create_connection"]
        },
        {
            "call": "listen",
            "typestate_use": true,
            "typestate_protocol": "socket",
            "typestate_action": "use",
            "receiver_types": ["socket.socket", "socket.create_connection"]
        },
        {
            "call": "accept",
            "typestate_use": true,
            "typestate_protocol": "socket",
            "typestate_action": "use",
            "receiver_types": ["socket.socket", "socket.create_connection"]
        }
    ]
}
