{
  "schema_version": 1,
  "framework": "flask",
  "version": "1.0",
  "description": "Flask framework taint sources, sinks, sanitizers, and nullness models",
  "detection": {
    "imports": ["flask", "Flask(", "@app.route", "@blueprint.route", "flask_login"],
    "patterns": ["render_template", "flask.request", "flask.redirect", "flask.abort"]
  },
  "models": [
    {"call": "flask.request.args", "taint_source": true, "category": "user_input"},
    {"call": "flask.request.form", "taint_source": true, "category": "user_input"},
    {"call": "flask.request.json", "taint_source": true, "category": "user_input"},
    {"call": "flask.request.data", "taint_source": true, "category": "user_input"},
    {"call": "flask.request.headers", "taint_source": true, "category": "user_input"},
    {"call": "flask.request.cookies", "taint_source": true, "category": "user_input"},
    {"call": "flask.request.files", "taint_source": true, "category": "user_input"},
    {"call": "flask.request.values", "taint_source": true, "category": "user_input"},
    {"call": "flask.request.get_json", "taint_source": true, "category": "user_input"},
    {"call": "flask.request.args.get", "taint_source": true, "nullness_nullable_return": true, "category": "user_input"},
    {"call": "flask.request.form.get", "taint_source": true, "nullness_nullable_return": true, "category": "user_input"},
    {"call": "flask.request.headers.get", "taint_source": true, "nullness_nullable_return": true, "category": "user_input"},
    {"call": "flask.request.cookies.get", "taint_source": true, "nullness_nullable_return": true, "category": "user_input"},
    {"call": "flask.request.files.get", "taint_source": true, "nullness_nullable_return": true, "category": "user_input"},
    {"call": "flask.request.values.get", "taint_source": true, "nullness_nullable_return": true, "category": "user_input"},
    {"call": "werkzeug.datastructures.MultiDict.get", "taint_source": true, "category": "user_input"},
    {"call": "werkzeug.datastructures.ImmutableMultiDict.get", "taint_source": true, "category": "user_input"},
    {"call": "flask.render_template_string", "taint_sink": true},
    {"call": "flask.redirect", "taint_sink": true},
    {"call": "flask.url_for", "taint_sink": true},
    {"call": "flask.make_response", "taint_sink": true},
    {"call": "flask.jsonify", "taint_sink": true},
    {"call": "flask.escape", "taint_sanitizer": true},
    {"call": "markupsafe.escape", "taint_sanitizer": true},
    {"call": "markupsafe.Markup", "taint_sanitizer": true},
    {"call": "werkzeug.security.generate_password_hash", "taint_sanitizer": true},
    {"call": "flask.current_app.logger.info", "taint_sink": true},
    {"call": "flask.current_app.logger.warning", "taint_sink": true},
    {"call": "flask.current_app.logger.error", "taint_sink": true},
    {"call": "flask.send_file", "taint_sink": true},
    {"call": "flask.send_from_directory", "taint_sink": true}
  ]
}
