{
  "schema_version": 1,
  "framework": "django",
  "version": "1.0",
  "description": "Django framework taint sources, sinks, sanitizers, and nullness models",
  "detection": {
    "imports": ["django", "from django", "import django", "django.db", "django.conf", "django.http"],
    "patterns": ["HttpResponse", "JsonResponse", "render(", "get_object_or_404"]
  },
  "models": [
    {"call": "django.http.HttpRequest.GET.get", "taint_source": true, "nullness_nullable_return": true, "category": "user_input"},
    {"call": "django.http.HttpRequest.GET.getlist", "taint_source": true, "category": "user_input"},
    {"call": "django.http.HttpRequest.POST.get", "taint_source": true, "nullness_nullable_return": true, "category": "user_input"},
    {"call": "django.http.HttpRequest.POST.getlist", "taint_source": true, "category": "user_input"},
    {"call": "django.http.HttpRequest.body", "taint_source": true, "category": "user_input"},
    {"call": "django.http.HttpRequest.headers.get", "taint_source": true, "category": "user_input"},
    {"call": "django.http.HttpRequest.COOKIES.get", "taint_source": true, "category": "user_input"},
    {"call": "django.http.HttpRequest.FILES.get", "taint_source": true, "category": "user_input"},
    {"call": "django.http.HttpRequest.META.get", "taint_source": true, "category": "user_input"},
    {"call": "django.shortcuts.render", "taint_sink": true},
    {"call": "django.template.Template.render", "taint_sink": true},
    {"call": "django.http.HttpResponse", "taint_sink": true},
    {"call": "django.http.JsonResponse", "taint_sink": true},
    {"call": "django.http.HttpResponseRedirect", "taint_sink": true},
    {"call": "django.shortcuts.redirect", "taint_sink": true},
    {"call": "django.utils.html.escape", "taint_sanitizer": true},
    {"call": "django.utils.html.strip_tags", "taint_sanitizer": true},
    {"call": "django.utils.html.format_html", "taint_sanitizer": true},
    {"call": "django.utils.http.url_has_allowed_host_and_scheme", "taint_sanitizer": true},
    {"call": "django.utils.text.get_valid_filename", "taint_sanitizer": true},
    {"call": "django.db.connection.cursor", "taint_sink": true},
    {"call": "django.db.connection.cursor.execute", "taint_sink": true},
    {"call": "django.core.files.uploadedfile.UploadedFile.read", "taint_source": true, "category": "file"},
    {"call": "django.core.files.uploadedfile.UploadedFile.chunks", "taint_source": true, "category": "file"},
    {"call": "django.core.files.uploadedfile.UploadedFile.name", "taint_source": true, "category": "file"}
  ]
}
